{
  "decision_log_id": "dec_customer_email_001",
  "timestamp": "2026-05-21T14:05:30Z",
  "workflow_id": "wf_customer_email_001",
  "action_id": "act_send_email_001",
  "agent_id": "agent_customer_support",
  "action_type": "send_customer_email",
  "action_boundary": "external_customer_communication",
  "approval_state": "AUTHORIZED",
  "previous_state": "RECOMMEND",
  "risk_level": "medium",
  "human_owner_role": "support_team_lead",
  "authorizer_id": "user_123",
  "authorizer_role": "support_team_lead",
  "decision_reason": "Reviewed draft; no legal or financial claim included; approved standard support response.",
  "policy_reference": "policy_customer_email_v1",
  "technical_trace_id": "trace_001",
  "tool_call_id": "tool_send_email_001",
  "external_system": "customer_email_platform",
  "external_reference": "email_draft_998",
  "outcome": "authorized_pending_execution"
}
